text,region,beach_name
"TYPE OF BEACH: Mostly sandy beach with some,
pebbles. The beach is near a large resort and 500,
meters form the center of the traditional village of,
Pythagorion.TYPES OF ENVIRONMENTAL AND,
EDUCATIONAL ACTIVITIES: Doryssa Bay Hotel in,
cooperation with the Municipality of Pythagorio has,
organized seminars, lectures and a vast collection,
of nature photographs as well as community,
based activities.FACILITIES: On the beach you can,
find organized water-sports, bar, restaurant,,
playground, tennis court, beach volley, and mini,
football court and mini golf.LANDSCAPE: The,
beach in front of the hotel is approximately315,
meters and part of a larger beach that extends,
from the Castle of Lycourgos to the village of Ireon.,
The part of the beach in front of the hotel is,
covered with small trees and flowerbeds, and part,
covered with grass.ACCESS: The access to the,
beach is possible through the small village based,
on the traditional architectural line of Samos with,
small stone covered paths wooden ramps and,
bridges. The entire resort is adjacent to the main,
road of Hora-Pythagorion.CONTACTS: For further,
information you my access our site for Doryssa,
Bay Hotel: www.doryssa-bay.gr and for the,
Municipality of Pythagorio: www.pythagorion.net",Samos,Potokaki1,"Potokaki 1, Beach located in Samos"
"Punta beach is a beautiful beach with pebbles, a ,
resort for the whole area of Egialia. The beach is ,
situated in the Municipality of Diakopto and is easily ,
accessible through the Old National Road Korinthu-,
Patras, just about three Klm, from the centre of ,
Diakopto. The Beach has  800 meters length and ,
30 meters width. Heather, Efkalyptus and pine ,
trees are all over the beach and there rooms to ,
rent, as well as, café and restaurants. There are ,
no organized sport facilities but during summer time ,
there are lectures and environmental activities ,
organized by the Municipality of Diakopto ,
(brochures, and information on marine and coastal ,
environment). For more information you can link to : ,
www.diakopto.gr/tourismos.htm",Achaia,Pounta,"Pounta, Beach located in Achaia"
,Lefkada,PortoKatsiki,"Porto Katsiki, Beach located in Lefkada"
,Preveza,Valtos,"Valtos, Beach located in Preveza"
,Voiotia,PlakaDilesiou,"Plaka Dilesiou, Beach located in Voiotia"
"MEGA AMMOS is located in Municipality of Sivota, ,
Thesprotia, GreeceType of Beach   : Beach with ,
sandResort BeachEnvironmental education ,
facilities: Conferences, Lectures, Clean up, ,
Expeditions Sea sport facilitiesHotels, rent ,
roomsLength of the beach: 250 m. Width : ,
Lifeguard/life saving equipmentFacilities for ,
disabled peopleTransportation: Sivota is directly ,
linked to the port of Igoumenitsa, to the Airport of ,
Ioannina and Corfu",Thresprotia,MegaAmmos,"Mega Ammos, Beach located in Thresprotia"
"“Platania” beach in Stavros Thessaloniki is a ,
beautiful sandy beach. It is located in the rural area ,
of Stavros in Strymonicos Bay and it is 1000 ,
meters long and 15 meters wide. The natural ,
environment of the beach is very rich since the ,
beach is located in a small wood of plane ,
trees.Schools and associations participate in the ,
cleaning of the beach very often and also take ,
pictures of the beaches. The pupils draw the ,
beauties of the sea and articulate their ideas and ,
suggestions both about the maintenance of the ,
existing beauty and about its qualitative ,
improvement.In the broadest area of the beach ,
there are plenty of hotels and rooms for rent that ,
can accommodate a great number of tourists ,
during the summer season. There are also many ,
facilities like car, motorbikes and bicycles rental as ,
well as sports facilities.The access to the beach is ,
easy, since Stavros is located on the 80th ,
kilometer of the National Road from Thessaloniki to ,
Kavala. Now that part of the Egnatia Road is ready, ,
the access is even easier. The beautiful ,
beach “Platania”  is located in the known wood of ,
plane trees of StavrosVisit our website: ,
www.dimos-rentinas.gr",Thessaloniki,StavrosKendriki,"Stavros/Kendriki , Beach located in Thessaloniki"
,Limnos,Thanos,"Thanos, Beach located in Limnos"
" , ",Limnos,Plati,"Plati, Beach located in Limnos"
" , ",Limnos,EvgatisZematas,"Evgatis/Zematas, Beach located in Limnos"
"Vatera beach is sandy with pebbles and in a,
touristic resort. In terms of environmental education,
activities, conferences, lectures, clean up and,
drawing competition are carried out. At the,
beaches there are hotel and rent a room. Sea,
sports, car, bikes and bicycle rental are being held.,
The length of the beach is,
approximately 8 km and the width 30m to 50m. The,
beach is full of trees and flowers such as pines,,
daisies and tulips. People can get to the,
beach by car, by taxi and bus. They can also link,
to the website of our municipality:,
www.polichnitos-lesvos.com",Lesvos,Vatera,"Vatera, Beach located in Lesvos"
"The hotel CRETA STAR is found on the Scaleta,
coastline in the municipality of Arkadi on the island,
of Crete, Greece. The Scaleta beach of the,
CRETA STAR hotel has a length of 250m and width,
30m, it is sandy and contains pebbles. Our tourist,
resort is found on the Scaleta coastline with other,
hotels and rent room accommodations. The,
environmental educational activities carried out in,
our hotel include conferences, seminars, lectures,,
coast cleaning and drawing competitions. Facilities,
which are available on our coastline include sea,
sports, rent-a-car, rent-a-bike and rent bicycles.,
Around the coast are found the «Tamarisk» trees,
and oleander bushes. The flora in the nearby,
areas include the daffodil sea, the fauna seen,
include the gull and the shallow. Access to the,
coast is from the interior of the hotel. To provide,
easy access to the beach for all of our customers,
and particularly persons with special needs,
wooden walkways and ramps exist.",Rethymno,Skaleta,"Skaleta, Beach located in Rethymno"
"The beach of Mikri Manitneia is a partly pebbly ,
partly sandy beach. On the beach there are ,
various trees, plants and palm trees. It is situated in ,
a populated area and is easily accessible by car.In ,
the wider area around the beach there are ,
apartments for rent serving the needs of visitors ,
during the summer. There are also many ,
restaurants, taverns, cafes, bars and clubs, ,
covering the entertainment needs of inhabitants ,
and visitors.The inhabitants of the area and the ,
visitors are sensitive as regards the protection of ,
the beach from pollution and collaborate with local ,
organisations for its protection.",Messinia,MIKRIMANTINIA,"MIKRI MANTINIA, Beach located in Messinia"
"
,
,
,
,
,
,
,         



, ",Lesvos,Kagia,"Kagia, Beach located in Lesvos"
"The beach which belongs to the Municipality of ,
Paralia stretches out in length 3, 5 km and has an ,
average width 40m. It is a sandy beach whose ,
main part (about 2 km) belongs to Paralia, a well – ,
known Tourist Resort. There are many hotels, ,
rooms to let and sport facilities. The remaining part ,
of the beach belongs in the rural areas of Kalithea ,
and Peristasi! In the area of Paralia annual, many ,
environmental and educational activities takes ,
place such a bicycle races, clean up programmes, ,
and seminars. Schools and their pupils participate ,
in these activities. The beach of Paralia is easily ,
reached via the National Road and Railway either ,
from Thessaloniki and Makedonia Airport or from ,
Athens.",Pieria,Paralia,"Paralia, Beach located in Pieria"
"Tsilivi is a beautiful sandy beach ,part of the tourist ,
region of Planos .Many seminars , clean ,
up,drawing competitions are carried out every  ,
year to the Tsilivi beach .A big variety of beach ,
sports ahd car-bices-bicycle rentals are available ,
around the beach .The municipal region of Planos ,
is a highly development tourist area with many ,
hotels –appartments –restaurant –tourist shop-,
super markets ,bars and travel agencies.Olive ,
trees and pinetrees are the main type of trees ,
around the beach.The access to the beach is easy ,
and safe from many different ways.",Zakynthos,TSILIVI,"Tsilivi, Beach located in Zakynthos"
,Thessaloniki,Vrasna,"Vrasna, Beach located in Thessaloniki"
,Lesvos,Ag.Isidoros,"Ag. Isidoros, Beach located in Lesvos"
,Limnos,AGIOANNIS,"Ag. Ioannis, Beach located in Limnos"
,Lesvos,KANONITHERMIS,"Kanoni Thermis, Beach located in Lesvos"
"Every year in the beach of Anaxos many,
environmental and educational activities take place,,
like: a) speechesb) cleaning of the beach,
and c) competition of painting. In the area of the,
beach various sport facilities are organized and,
every visitor can rent car, bikes and bicycles.,
Every visitor can enjoy his staying in Anaxos, in,
luxurious hotels or traditional rending rooms. The,
length of the beach is 550m and the size 2m. The,
flora is combined by a special kind of plant, which,
is called ‹‹armirikia››. Great place in the fauna of,
Anaxos has the birds’ Aegean gulls and Silver,
gulls. Significant is the fact that everyone can,
easily go to the beach on the foots. More,
information is available in Internet, in the address,
www.petra.gr",Lesvos,Anaxos,"Anaxos, Beach located in Lesvos"
,Serres,Kyani,"Kyani, Beach located in Serres"
"- SANDY - PEBBLES,
RESORT - LIFEGUARD/LIFESAVING,
EQUIPMENT, FACILITIES FOR THE,
DISABLED PEOPLE, SPORT FACILITIES,,
RENT CAR/BIKES/BICYCLES, HOTELS,,
RENT ROOMS,
- SEMINAR, LECTURE, CLEAN UP,,
DRAWING COMPETITION,
- 5TH JUNE - 1ST JULY.",Magnisia,Platanidia,"Platanidia, Beach located in Magnisia"
"“Rihios” beach in Stavros Thessaloniki is a,
beautiful sandy beach. It is located in the rural area,
of Stavros in Strymonicos Bay and it is 1000,
meters long and 30 meters wide. Around the,
beach there are many plane trees and,
bushes.Schools and associations participate in the,
cleaning of the beach very often and also take,
pictures of the beaches. The pupils draw the,
beauties of the sea and articulate their ideas and,
suggestions both about the maintenance of the,
existing beauty and about its qualitative,
improvement.In the broadest area of the beach,
there are plenty of hotels and rooms for rent that,
can accommodate a great number of tourists,
during the summer season. There are also many,
facilities like car, motorbikes and bicycles rental as,
well as sports facilities.The access to the beach is,
easy, since Stavros is located on the 80th,
kilometer of the National Road from Thessaloniki to,
Kavala. Now that part of the Egnatia Road is ready,,
the access is even easier. The signs in the,
entrance of Stavros show the way to the beautiful,
beach “Rihios”.Visit our website: www.dimos-,
rentinas.gr",Thessaloniki,StavrosDytiki,"Stavros/Dytiki, Beach located in Thessaloniki"
"SANDY,URBAN,LIFEGUARD/LIFESAVING ,
EQUIPMENT-HANDICAP FACILITIES-RENT ,
CAR/BIKES/BICYCLES-HOTELS/RENT ,
ROOMS,PINE TREES,CLOSE TO ,
TOWN,LECTURE-CLEAN ,
UP,WWW.MYTILENE.GR",Lesvos,Tsamakia,"Tsamakia, Beach located in Lesvos"
"SANDY,RESORT,LIFEGUARD/LIFESAVING,
EQUIPMENT-HANDICAP FACILITIES-,
HOTELS/RENT ROOMS,THROUGH THE,
TOWN TOWARDS THE SEASIDE,SEMINAR-,
LECTURE-CLEAN UP,5/6-1/7",Magnisia,NEAAGCHIALOS,"Nea Agchialos, Beach located in Magnisia"
"In the graphic village Afissos it is found in the ,
Pagasitikos gulf 27 kms from Volos. His place is the ,
southern Pilion and belongs in the D. Afeton. He is ,
built amphitheatrical in olive groves and is framed ,
from two  very beautiful coasts and sand. The ,
Kallifteri  and the Abovos, with length 200 metres ,
and width 30 metres, what remain clean all the time ,
with responsibility of Demotic authority.,
Ideal resort  for marine bathrooms, fishing, ,
marinely spor. Exist marvellous hotels of each ,
order, Hostels, furnished apartments and the ,
organised offices of rentings of cars, motor  ,
cycles and bicycles. ,
Each time in the square exists permanent report of ,
painting and photograph. All these make ,
comfortable and pleasant stay …..",Magnisia,Kalifteri,"Kalifteri, Beach located in Magnisia"
"Type of beach: Beach of sand.Type of area: ,
Resort area.Description of environmental education ,
facilities: ·	Seminar·	Lecture ·	Clean ,
upFacilities of the beach: There are no ,
facilities.Description of the location of the beach:·,
Hotels·	Rent roomsDescription ,
of nearby natural areas:Length of the beach: 400 ,
mWidth of the beach: 7 mType of trees: Pear ,
trees.Description how to get to the beach: Through ,
country road Volos - Tsagkarada",Magnisia,KoropiBoufa,"Koropi/Boufa, Beach located in Magnisia"
,Magnisia,Koukounaries,"Koukounaries, Beach located in Magnisia"
"Type of beach: Beach of sand.Type of area:,
Resort area.Description of environmental education,
facilities: · Seminar· Lecture · Clean,
upFacilities of the beach: There are no,
facilities.Description of the location of the beach:·,
Hotels· Rent roomsDescription,
of nearby natural areas:Length of the beach: 600,
mWidth of the beach: 8 mType of trees: Plane,
trees.Description how to get to the beach: Through,
beach road of Kala Nera.",Magnisia,KalaNera,"Kala Nera, Beach located in Magnisia"
,Magnisia,Amfanon,"Amfanon, Beach located in Magnisia"
,Magnisia,Maratha,"Maratha, Beach located in Magnisia"
"The type of beach is sandy one. It is situated in a,
beautiful resort area. There are no sea sports,
taking place at the greater area of the beach nor,
there are no rent a bike/car/bicycle offices. There,
is also a number of rooms that can be rented and,
two small hotels . The length of the beach is about,
200 meters and its five to ten meters in some spots,
wide. Around the area the tree that is in big,
population is the olive tree and some bushes, and,
as it concerns for the fauna inside the sea you can,
find most of the common greek fish like Mullet,,
Annullar Gilthead, Painted Comber, Demoiselles,,
Rainbow wrasse etc.The swimmers can reach the,
beach from the nearby city of Volos(10 km km,
from the beach) via buses or taxi or they can rent,
a car from a noumerous offices in Volos . Also,
from our municipality two buses are going to the,
beach every day during the swimming periodThe,
environmental activities being organized are,
lectures , beach cleaning acts paint contests,,
seminars about various and serious environmental,
subjects. They are organized by Municipality of,
Aisonia itself or in co-opertaion with other,
organizations, schools, ngo’s etc.",Magnisia,ChrysiPanagia,"Chrysi Panagia, Beach located in Magnisia"
,Magnisia,Amarylida,"Amarylida, Beach located in Magnisia"
"Type of beach: Beach of sand.Type of area: ,
Resort area.Description of environmental education ,
facilities: SeminarLecture Clean upFacilities of the ,
beach: There are no facilities.Description of the ,
location of the beach:HotelsRent roomsDescription ,
of nearby natural areas:Length of the beach: 300 ,
mWidth of the beach: 6 mType of trees: Plane ,
trees.Description how to get to the beach: Through ,
beach road of Kala Nera.",Magnisia,KALANERATHERETROAXIOMATIKON,"Kala Nera/Theretro Axiomatikon, Beach located in Magnisia"
,Magnisia,ADRINA,"Adrina, Beach located in Magnisia"
"“Milies” beach in Stavros Thessaloniki is a beautiful,
sandy beach. It is located in the rural area of,
Stavros in Strymonicos Bay and it is 1000 meters,
long and 20 meters wide. Around the beach there,
are many trees, mostly plane trees and,
acacias.Schools and associations participate in the,
cleaning of the beach very often and also take,
pictures of the beaches. The pupils draw the,
beauties of the sea and articulate their ideas and,
suggestions both about the maintenance of the,
existing beauty and about its qualitative,
improvement.In the broadest area of the beach,
there are plenty of hotels and rooms for rent that,
can accommodate a great number of tourists,
during the summer season. There are also many,
facilities like car, motorbikes and bicycles rental as,
well as sports facilities.The access to the beach is,
easy, since Stavros is located on the 80th,
kilometer of the National Road from Thessaloniki to,
Kavala. Now that part of the Egnatia Road is ready,,
the access is even easier. The beautiful,
beach “Milies” is located in the area “Milies” 1 km,
from Stavros city center.Visit our website:,
www.dimos-rentinas.gr",Thessaloniki,StavrosAnatoliki,"Stavros/Anatoliki, Beach located in Thessaloniki"
" , , , , ",Lesvos,Molyvos,"Molyvos, Beach located in Lesvos"
"Very close to Volos Agria offers interesting choise,
as far as summer swimming as concerned.,
The “Barba Thoma” beach is a rocky beach in,
Soutrali Area of municipality of Agria. It is an urban,
beach and is located in the boarders of municipality,
of Agria with municipality of Artemida The,
environmental education facilities concerns,
activities such as lecture, for the international,
forest day, and the prevention of fires. Also were,
published relative leaflets for recycling program of,
paper and the prevention of fires. Finally, for the,
event Magnesia : a enchanting, natural, cultural,
and structured environment were taken place,
photo, literary texts, and works of painting,
expedition. At this area, there are a hotel,
named “Barbara” and three rend rooms,
named “Delkis”, “Bokou” and “Thomas” rend,
rooms. The length of the beach is about 200,
meters and the width about 15 meters. There are,
plants such us palms, eycalyptuses, almirikia end,
not far away from the beach are orchards with,
olives and citrus fruits. It is very close to Volos,
and easily to get there : As you drive from Volos to,
Tsagarada keep the sea on your left hand side and,
after 7 km you get to the municipality of Agria.,
Proceed through Agria which has a few tavernas,
on the left hand and a beach to the right. Turn right,
at the sign Soutrali and continue on this road,
towards the “Barba Thoma” beach. E-,
mail:MUNICIPAGRIA@INTERNET.GR No Webside",Magnisia,AgriaBarbaThomas,"Agria / Barba Thomas, Beach located in Magnisia"
"In the graphic village Afissos it is found in the ,
Pagasitikos gulf 27 kms from Volos. His place is the ,
southern Pilion and belongs in the D. Afeton. He is ,
built amphitheatrical in olive groves and is framed ,
from two  very beautiful coasts and sand. The ,
Kallifteri  and the Abovos, with length 200 metres ,
and width 30 metres, what remain clean all the time ,
with responsibility of Demotic authority.,
Ideal resort  for marine bathrooms, fishing, ,
marinely spor. Exist marvellous hotels of each ,
order, Hostels, furnished apartments and the ,
organised offices of rentings of cars, motor  ,
cycles and bicycles. ,
Each time in the square exists permanent report of ,
painting and photograph. All these make ,
comfortable and pleasant stay …..",Magnisia,Abovos,"Abovos, Beach located in Magnisia"
,Thessaloniki,Peraia,"Peraia, Beach located in Thessaloniki"
"
“Eftalou” is the country place of Molyvos. It ,
has been the sea resort of its inhabitants, since ,
the ancient times with a special natural beauty. In ,
Eftalou, someone will also find the hot springs and ,
our healing spas. In Eftalou, there are also ,
situated the country houses (koules) of spiritual ,
people of Greece, like Argiris Eftaliotis, who came ,
from Mithymna (he took his pseudonym from the ,
place of Eftalou) and Ilias Venezis. Eftalou ,
preserves the authenticity of its landscape, as it is ,
a lightly structured area with a few big hotels and ,
small tourist housings, in a small distance from the ,
coasts. Eftalou coasts have small grey stones ,
and they are fully planted by heaths. Eftalou ,
coasts have also fringes, upon which they lie lot of ,
stubbles, sea violets, bushes and yellow ,
amaranths, depending on the season. In addition, ,
the hills that surround these coasts are fully ,
planted by olive-trees, pine-trees and gardens. ,
By the sea, there are also rocky large stones with ,
elaborate designs, that stand there for centuries ,
and they make up admirable geological ,
monuments. The sea-shores of Eftalou are an ,
elective choice for lots of visitors, as well as for ,
locals, who consciously reject the so-,
called “plastic convenience”. The contact with the ,
esthetic of the landscape, the nature and the ,
sparkling water in Eftalou, is a unique ,
experience. The renting of the coasts to ,
individuals is not allowed. Thus, it is not possible ,
there for anyone to view plastic chairs, ,
antiaesthetic umbrellas or water sports. As far ,
as the services of the swimmers are concerned - ,
who in their majority belong to the admirers of ,
nature and natural environment - there are only the ,
absolutely necessary substructions, such as ,
distinctive information tables, toilets, showers as ,
well as distinctive dressing rooms. Access to ,
the beginning of the sea-shores, can also be ,
succeeded by car, since the road till a certain point ,
is asphalt. However, just before the healing spas ,
of Eftalou and the main coast of Saint-Anargiri, ,
visitors can only walk. The distance though, from ,
the point the car stops does not exceed the 400 ,
metres. The length of the central coast of ,
Saint-Anargiri is about 600M and its width is 60M.",Lesvos,EftalouAg.Anargyroi,"Eftalou /Ag. Anargyroi, Beach located in Lesvos"
"Type of Beach: With sand Or urban,
beachDescription of the environmental education,
facilities, Seminar, Lecture, Clean up.No sport,
facilities, No rent a car bikes, and,
bicycles.Description of the location of the beach,
Hotels and rooms for rent.Description of nearby,
natural areas, leugth of the beach 4650 m2 AND,
width 30 m. Description of how to get to the beach.,
The beach has two inclined entrance steps,,
wooden walkways to the showers and a,
ramp.Describtion of nearby natural areas leugth of,
the beach 16.530 m2, width 20 m. Description of,
how to get to the beach there are wooden,
walkways and rawps all the year – time at the,
beach.",Magnisia,Anavros,"Anavros, Beach located in Magnisia"
" , ",Thessaloniki,Serraiki,"Serraiki, Beach located in Thessaloniki"
"5 km west of the center of Igoumenitsa, you can ,
find a wide stretch of white sandy beaches with ,
crystal shallow blue waters. Ideal for families and ,
people that enjoy water sports- such as water ,
skiing, wind surfing, water rides etc. Close to ,
the beaches you will find small sea pond areas ,
where blue and white cranes breed and live. ,
Eucalyptus trees, which give some shade, line the ,
road parallel to the beach. You can also find ,
facilities for camping and caravan parking.Along ,
the 8 km stretch of beach there are few café bars, ,
which serve a variety of good food and drinks. ,
There are also tennis, volley and basketball courts ,
where people can play and during the year ,
tournaments are held.Every summer there are ,
exhibitions programs with photographic and ,
paintings of the area. Children’s water games from ,
the ages 6-12 years are also held together with ,
serious tree planting programs. You can visit these ,
beaches using cars or local buses, which leave ,
the town regularly (every half hour). There is also ,
a local path (paved) where people can walk or ride ,
bicycles to the beaches.",Thresprotia,Drepano,"Drepano, Beach located in Thresprotia"
"Type of Beach: With sandResortDescription of the,
environmental education facilities, Seminar,,
Lecture, Clean up.No sport facilities, No rent a car,
bikes, and bicycles.Description of the location of,
the beach Hotels and rooms for rent.Description of,
nearby natural areas, leugth of the beach 30.520,
m2 ánd width 20 m. Free entrance by a street,
along the beach, ramps to the showers and a ramp,
for people with special needs.",Magnisia,Alykes,"Alykes, Beach located in Magnisia"
,Thessaloniki,NeoiEpivates,"Neoi Epivates, Beach located in Thessaloniki"
,Lefkada,MikrosGialosPoros,"Mikros Gialos/Poros, Beach located in Lefkada"
,Thessaloniki,PORTOFINO,"Porto Fino, Beach located in Thessaloniki"
" , , ,
",Thessaloniki,NeaVrasna,"Nea Vrasna, Beach located in Thessaloniki"
,Thessaloniki,AgiaTriadaPikpa,"Agia Triada/Pikpa, Beach located in Thessaloniki"
 ,Thessaloniki,Potamos,"Potamos, Beach located in Thessaloniki"
,Lefkada,Nydri,"Nydri, Beach located in Lefkada"
"The Saint Isidoros is a beach with pebbles, it has,
500 meters length, 10 meters width and is both an,
urban area and a summer resort. It is surrounded,
by mountains and has rich flora (olive trees,,
cypresses, mulberries) and fauna (labruses,,
octopuses, dolphins, prawns, lobsters, ink,
fishes). It is only 2 kilometers far from the village,
of Antikyra and 35 kilometers from the capital of,
our local area. Also, Antikyra has the advantage,
that it is not far away from Athens, the capital of,
Greece, it is only 160 Km from it. Visitors are easy,
to come in Antikyra by driving their cars or using,
the public transport. In Antikyra and beach of,
Saint Isidoros there are a lot of hotels and rent,
rooms, which offer all the modern facilities.,
Also, there are environmental education facilities,
like drawing exhibition, fishery seminars, and,
beach cleaning. Website of Antikyra :,
www.antikyra.gr",Voiotia,Ag.Isidoros,"Ag. Isidoros, Beach located in Voiotia"
,Lefkada,AiGiannis,"Ai Giannis, Beach located in Lefkada"
"SANDY/PEBBLES, RURAL,,
LIFEUARD/LIFESAVING EQUIPMENT-,
-SPORT FACILITIES,,
CLOSE TO MAIN ROAD, CONFERENCE -,
SEMINAR - LECTURE-CLEAN UP",Lefkada,LefkadaGyra,"Lefkada Gyra, Beach located in Lefkada"
,Lefkada,Lefkada,"Lefkada, Marina located in Lefkada"
