text,region,beach_name
"Name of the beach: Logaras,
Corporation: Municipality of Paros,
Address: Parikia, Paros,
Community: Kyklades,
P.C. : 84400,
Tel.: 2284021200,
Fax: 2284024752,
Type of beach: Beach with sand,
Placed in urban area,
Description of the environmental education,
facilities: Lectures, Clean up.,
Facilities: Sport facilities,
Description of the location of the beach: Hotels and,
Rent rooms,
Description of nearby natural areas:Length of the,
beach: 1,500 mWidth of the beach: 100 mType of,
trees: Sea treesOther: Sand hills,
Description of how to get to the beach:By bus, car,,
motorbike, bike, feet.,
Link to website for the beach/municipality:,
www.paros.gr,
,
Logaras beach is a sandy beach placed in urban,
area. It‘s popular for the entertainment facilities,
such as restaurants, taverns and coffee shops.,
Very close to the beach you can find hotels and,
rent rooms to stay. The beach has length 1,500,
meters and width 100 meters approximately and,
there sea trees for shadow. You can go to the,
beach by bus, car, motorbike, bicycle and/or by,
feet. More information you can find on the link:,
www.paros.gr.",Kyklades,Logaras,"Logaras, Beach located in Kyklades"
"Kamares is the largest township on the island and,
its port since the end of the last century. The,
main district is located to the right of the bay of,
Kamares, and here you will find, among other,
things, travel agencies, shops, groceries,,
restaurants, a news agency, convenience shops,,
pastry shops, pottery workshops and galleries,,
hotels apartments and rooms to rent, bike & car,
rentals, and a private camping ground. On the,
other side of the bay, at the foothills of,
mountain “Saint Simeon” is the quarter of “Saint,
Marina”, also known as “Pera Panta”, where you,
will find taverns and rooms to let. Between these,
two districts of Kamares is a long (750 m) and,
wide (15-100m) beach with golden sand which is,
also a perfect spot from where you may enjoy the,
sunset.Trees, bushes, floraPhragmites SSP,,
Vunus maritimus, Vitex agnus-cactus, Pancratium,
maritimus, Euphorbia terracina, Euphobia Paralias,,
Malcolmia SPT, Wild cedar, Juniperus SP, Medicago,
Marina.Type of Fauna Erinaceus concolor,,
Podarcis milensis, Vipera Labetina, Phalacrocoropa,
arislobellis, Ardea cinerea, Alcedo atthis, Buteo,
buteo, Falco tinnunculus, falco eleanuro, Tyto alba,,
Motacilla alba, owls, sparrows, seagulls, crows,,
turtles... Sand dunes Beaches are,
ecologically sensitive areas as they are the,
meeting point of land and sea. An ecosystem of,
special characteristics develops in these,
conditions. Sand dunes are an important ecological,
beach element and presently they are protected,
by E. U regulations due to their importance to,
ecology. Sand dunes host many,
kinds of plant and animal life perfectly adapted to,
the special climatological and ecological beach,
environment. Sand dunes also protect the beach,
from erosion. In the past beach sand,
dunes were very common. Nowadays they are,
almost vanished. Therefore the areas that still,
sustain sand dunes in good condition are equipped,
with significant ecological wealth and they are,
obliged to protect them also for the,
future.KAMARES LAKE Kamares beach has up to,
this date preserved considerable natural wealth:,
sand hills, beach plants (tamarisks, lilies, culms):,
an overall healthy ecosystem. The recent natural,
disaster owed to the heavy rainfalls led to one,
good thing",Kyklades,Kamares,"Kamares, Beach located in Kyklades"
,Kyklades,Kamari1,"Kamari 1, Beach located in Kyklades"
"SANDY,RESORT,LIFEGUARD/LIFESAVING,
EQUIPMENT- SPORT,
FACILITIES-RENT CAR/BIKES/BICYCLES-,
HOTELS/RENT ROOMS,BRINE,
TREES,THROUGH THE TOWN TOWARDS,
THE SEASIDE,SEMINAR-LECTURE-CLEAN,
UP-DRAWING/PHOTO,
COMPETITION,WWW.CYCLADES-,
INFO.GR",Kyklades,Galissas,"Galissas, Beach located in Kyklades"
"The coast finds in built-up band, her type is ,
ammodis and has length 1200m. roughly and width ,
30m. roughly. Ashore they exist armirikia a species ,
of trees that sprouts the coasts, cedars the type ,
Juniperus oxycedrus ssp. Macrocarpa kaj ,
ammocines. In her wider space exist hotels/rented ,
rooms, cafeterias/restaurants, become rentings of ,
cars, motor cycles and bicycles also they become ,
also marine spor. The access ashore is easy ,
because oll the cars are parking areas free of ,
charge in spaces of quartering rented from the ,
Municipality Naxos that is found near ashore. The ,
environmental activities concern in cleaning of ,
coasts, reports on the subject the environment and ,
seminars.",Kyklades,Ag.Prokopios,"Ag. Prokopios, Beach located in Kyklades"
"MUNICIPAL TOURIST ENTERPRISE FOR CULTURAL,
AND TOURIST DEVELOPMENT (DEPOTAS),
ADDRESS: 6, A. PAPANDREOU, 72300 SITIA,
CRETE GREECETEL: 2843023775FAX:,
2843022681NAME OF THE BEACH: SITIA BAY II-,
PETRASType of the beach: Urban beach with sand,
and pebbles.Description of the environmental,
education facilities: Conferences, seminars, clean,
ups.Facilities: Rent a car, bikes,,
bicycles.Description of the location of the beach:,
hotels, rent rooms, apartments.Description of how,
to get to the beach: It’s 500 m. from the center of,
the town the way to Vai.Description of nearby,
natural areas:Length and width: 350 m. 5 m.Type,
of trees and bushes: Pinus brutia, platans, poplar,
trees, the famous palm- grove Vai (Phoenix,
Theofrasti), laurels, Sarcopoterium Spinosum,,
Genista axanthoclada, Thymus capitalus, Ebenus,
cretica, wild olive trees, evergreen oaks, lentisks,,
wild carob trees.Type of fauna: a. Birds: Falcon,
(Falco Elaeonorae), Falco peregrinus, Falco,
biarmicus, Calonenectris diomedea, Puffinus,
yelcouan, Larus auduinii, Gypaetus barbatus,,
Aquila chrysaetos, Gyps fulvus.b. mammals:,
Acomys minous, Martes foina, Meles meles. At the,
sea : Monachus monachus, Stenella coeruleoalba,,
Caretta caretta.c. Reptiles: Chalcides occelatus,,
Lacerta trilineata, Telescopus fallax, Colluber,
gemonensis, Oxychilus aegopinoides.Type of flora:,
Anthemis filicaulis, A. tomantella, Thymbra,
calostachys, Asperoula crassula, Tulipa cretica,,
Erysimum creticus, Petromarula pinnata,,
Campanula pelviformis.",Lasithi,Siteia2Petra,"Siteia 2/Petra, Beach located in Lasithi"
,Kyklades,Delavogia,"Delavogia, Beach located in Kyklades"
"“Shisma” coastline is to be found in the Department ,
of Elounda, Agios Nikolaos, Lasithiou, Crete, ,
Greece. The Authority responsible for the coastline ,
is K.EP.AN.EL. (The Local Authority for ,
Development in Elounda).  The beach is to be found ,
within the housing area of Shisma close by the ,
village square.  Access to the beach is by car or ,
by foot and there are access ramps for people ,
with Special Needs. The beach is 300m long and ,
150m wide and is covered in sand. At the South ,
end of the beach is a parking area for coaches ,
that bring visitors to Elounda from other parts of ,
the island.  At the North end of the beach there is a ,
jetty where visitors to the beach may park their ,
private or rented cars and where the centre for ,
Water sports is situated.  Facilities include canoe, ,
windsurfing and water-ski. Across the Southwest ,
side of the beach there is a small green area ,
planted with eucalyptus, palm and diandes trees. ,
By the Southwest side of the beach runs the local ,
road from Elounda to Plaka along which are a ,
variety of Apartments, Hotels, Tavernas and Café ,
bars. During of the summer Municipality –,
K.EP.AN.EL. – Organize environmental activities. ,
Information about these activities is available from ,
the Municipality Tourist Information Office.",Lasithi,Schisma,"Schisma, Beach located in Lasithi"
,Kyklades,Koundouros,"Koundouros, Beach located in Kyklades"
,Kyklades,Ag.AnnaMaragas,"Ag. Anna Maragas, Beach located in Kyklades"
,Lasithi,Plaka,"Plaka, Beach located in Lasithi"
"The coast finds in built-up band, her type is ,
ammodis and has length 850m. roughly and width ,
20m. roughly. Ashore they exist armirikia a species ,
of trees that sprouts the coasts. In her wider ,
space exist hotels/rented rooms, ,
cafeterias/restaurants, become rentings of cars, ,
motor cycles and bicycles also they become also ,
marine spor. The access ashore is easy because ,
oll the cars are parking areas free of charge in ,
spaces of quartering rented from the Municipality ,
Naxos that is found near ashore. The ,
environmental activities concern in cleaning of ,
coasts, reports on the subject the environment and ,
seminars.",Kyklades,AG.GEORGIOS,"Ag. Georgios, Beach located in Kyklades"
,Lasithi,Myrtos,"Myrtos, Beach located in Lasithi"
"The awarded beach “Pilos” is in front of the small ,
luxurious hotel Istron Bay, 13 kms from the ,
picturesque town of Agios Nikolaos and 2 kms ,
away from the next village Istron.An easy to ,
access beach with sand and pebbles, very well ,
equipped and safe to approach the sea, ideal for ,
children. Very close to it two first aid stations, one ,
belonging to a well organized diving centre, the ,
telephone, and the beach restaurant of the hotel ,
with Cretan and Mediterranean cuisine.Pilos is a ,
particular beautiful beach, quiet and isolated ,
optically from the hotel by a steep cliff of a sandy ,
hill with sea pines. It has been praised repeatedly ,
by the Greek and International Press for the unique ,
colours of the sea.",Lasithi,Pilos,"Pilos, Beach located in Lasithi"
,Kyklades,AgFokas,"Ag. Fokas, Beach located in Kyklades"
"The Palm forest of VAI  is about 6 km  from ,
Palekastro. Is has a sandy beach with length 200 ,
m and wade 40 m . It’s a place where you can ,
swim, make water sports and diving.The palm ,
forest is situated in an area with ecological interest ,
and its near the beautiful beaches of Hiona, ,
Maridati and Kouremenos. In Kouremenos and to ,
the villages of Palekastro and Agathias there are ,
many hotels and rooms which can accommodate ,
the visitors.The flora of the area is very interesting ,
with many kind of plants. The unique kind of palm ,
tree “theofrastos” there is only in the palm ,
forest.You can go to Vai by car or by bus  from ,
Sitia which is about 26 km .",Lasithi,VaiFinikodasos,"Vai/Finikodasos, Beach located in Lasithi"
"Beach Koutsounari is near the Hotel MAGIC LIFE ,
LYKTOS which is the manager of it. It is in the ,
Koutsounari village and 7 km away from the town ,
of Ierapetra, on the national road Ierapetra – ,
Sitia.The Beach wich is well known as “The Big ,
Beach” has dark sand and pebbles. The beach has ,
sea-sports (ski – banana) , umbrellas, seats, ,
wooden walkways, and many other facilities.Each ,
year there are always some environmental action ,
like cleaning of the beach, tree plantings, painting ,
contest, lectures and other.Please visit our web – ,
page  www.magiclife.com.",Lasithi,KoutsounariAg.Ioannis,"Koutsounari/ Ag. Ioannis, Beach located in Lasithi"
,Lasithi,Koutsounari2,"Koutsounari 2, Beach located in Lasithi"
,Lasithi,LIMANAKI,"Limanaki, Beach located in Lasithi"
"Type of Beach: Beach with sand, pebblesUrban ,
Beach.Description of the environmental education ,
facilities : Clean up, Drawing and photo ,
competition.Facilities:Sport facilities : ÍïRent a car : ,
NoRent a bikes : NoRent a bicycles : NoDescription ,
of the location of the beach:Hotels : YesRent ,
rooms : YesDescription of nearby natural areas-,
Length of the Beach : 50m    - Width : 20mType of ,
Trees : Saline trees-Type of fauna : Seagulls, ,
Sparrows, Blackbirds, ChaffichesSkylarks, ,
Thrushes.Description of how to get to the ,
beach:The safe access on the beach is doing ,
through ramps-wooden Courses.",Lasithi,Kitroplateia,"Kitroplateia, Beach located in Lasithi"
"The “KALIMERA KRITI”  hotel in Sissi Lassithi Crete, ,
is the implementing body which manages the Blue ,
Flag programme and looks after “Spiliada” ,
beach. “Spiliada” is a sandy beach 300m. long and ,
35 m. wide, situated in a tourist resort with a rich ,
and beautiful natural environment composed o ,
tamarisks eucalypts almond trees pines carob ,
trees and shrubs in which migratory birds ,
thrushes woodcock badgers wildcats and hares ,
find refuge.Access to the beach is immediate with ,
pretty paths and byways leading bathers to one of ,
the island’s cleanest beaches. At the beach there ,
is access to all necessary lifesaving equipment ,
and a lifeguard for bather safety. Water sports are ,
organized within a limited area while car motorbike ,
and cycle hire is not allowed. There are umbrellas ,
and deckchairs along the beach and also a free ,
area for bathers who do not wish to use ,
these. “Spiliada” beach is cleaned by machine ,
every two days and by hand 3-4 times a day. ,
There are signs providing information an available ,
services. For full visitor information there is also a ,
noticeboard at the entrance to the beach giving ,
details o the results of swimming water tests ,
programme leaflets code of conduct lifeguard ,
hours and all educational activities. The “Kalimera ,
Kriti Hotel” organizes seminars conferences ,
demonstration visits and nature walks beach clean-,
ups etc. every year to educate and sensitise  the ,
public to environmental matters.",Lasithi,Spiliada,"Spiliada, Beach located in Lasithi"
"Type of the beach: Urban beach with sand and ,
pebbles.Description of the environmental education ,
facilities: Conferences, seminars, clean ,
ups.Facilities: Rent a car, bikes, ,
bicycles.Description of the location of the beach: ,
hotels, rent rooms, apartments.Description of how ,
to get to the beach: It’s 100 m from the center of ,
the town the way to Vai.Description of nearby ,
natural areas:Length and width: 350 m.  8 m.Type ,
of trees and bushes: Pinus brutia, platans, poplar ,
trees, the famous palm- grove Vai (Phoenix ,
Theofrasti), laurels, Sarcopoterium Spinosum, ,
Genista axanthoclada, Thymus capitalus, Ebenus ,
cretica,  wild olive trees, evergreen oaks, lentisks, ,
wild carob trees.Type of fauna: a. Birds: Falcon ,
(Falco Elaeonorae), Falco peregrinus, Falco ,
biarmicus, Calonenectris diomedea, Puffinus ,
yelcouan, Larus auduinii, Gypaetus barbatus, ,
Aquila chrysaetos, Gyps fulvus.b. mammals: ,
Acomys minous, Martes foina, Meles meles. At the ,
sea : Monachus monachus, Stenella coeruleoalba, ,
Caretta caretta.c. Reptiles: Chalcides occelatus, ,
Lacerta trilineata, Telescopus fallax, Colluber ,
gemonensis, Oxychilus aegopinoides.Type of flora: ,
Anthemis filicaulis, A. tomantella, Thymbra ,
calostachys, Asperoula crassula, Tulipa cretica, ,
Erysimum creticus, Petromarula pinnata, ,
Campanula pelviformis.",Lasithi,Siteia1Galliko,"Siteia 1/Galliko, Beach located in Lasithi"
,Lasithi,Kouremenos,"Kouremenos, Beach located in Lasithi"
,Lasithi,KATOZAKROS,"Kato Zakros, Beach located in Lasithi"
,Lasithi,Ierapetra2Dimotiki,"Ierapetra 2/ Dimotiki, Beach located in Lasithi"
,Lasithi,Ierapetra1Dimotiki,"Ierapetra 1/ Dimotiki, Beach located in Lasithi"
"
,
,
,
,
,
,
,         



",Lasithi,Elounda Pigaidakia,"Elounda Pigaidakia, Beach located in Lasithi"
"The Elounda Mare hotel is a seaside 160-bed ,
luxury hotel with extensive gardens of lawns, olive ,
trees, hibiscus, bougainvillea, oleander, jasmine, ,
roses, rosemary, etc. and has about 500m. of ,
coastline, including a sandy beach and rocky ,
promontories. We have received the Blue Flag for ,
the past 10 years running. The sandy beach is ,
about 50m. wide and 30m. deep, and is enclosed in ,
a tiny cove that protects it from the waves. The ,
entrance to the cove is closed off by red buoys, ,
and so is a swimmers-only zone extending about ,
100m. from the coastline. The beach can be ,
accessed only through the hotel, using tiled ,
pavements and masonry staircases and ramps. ,
The water sports facilities are located on one of ,
the rocky promontories and are secluded from the ,
beach. All manner of water sports are available, ,
including water ski, scuba diving, sailing, wind ,
surfing, and canoes. There are also jet skis, that ,
are carefully regulated by the local port authorities ,
as follows:1. No jet skis are allowing in the ,
afternoon, during the “siesta hours” (2-5pm.)2.,
Jet skis are not permitted to plane ,
near the coastline by more than 200m. and are ,
required to maintain idle speed within this zone ,
only for entering and exiting.3. All jet skis ,
have to be equipped by a remote-controlled ,
automatic cut-off system, in case the user violates ,
any of the rules. The hotel is environmentally ,
aware and promotes environmentally friendly ,
practices, despite adverse market conditions. A ,
scheme for recycling office paper failed dismally ,
when we discovered that the recycling contractor ,
did nothing of the kind and actually dumped the ,
paper in a landfill, only to collect the subsidies. The ,
hotel invested € 160.000 in order to build a new ,
wastewater treatment plant of the highest ,
standards. Besides biological treatment ,
(continuous aeration and sludge recycling), we ,
also do multimedia filtration, chlorination, membrane ,
filtration and UV disinfection.Our wastewater ,
treatment plant is visited every year by local ,
schools and the children receive a comprehensive ,
lecture about its operation and the importance of ,
treating wastewater as far as the impact to ,
groundwater and the coast are concerned. In ,
addition, we schedule annual cleaning expeditions ,
with a team of hotel technicians to the local roads, ,
secluded beaches, the Elounda salt marsh, and the ,
chapel of St.Fokas. We inform our staff and guests ,
about our activities and make sure we participate ,
in all the important environmental holidays (Earth ,
Day, World Environment Day, Blue Flag Day, and ,
Clean Up the World Day),
,
The Porto Elounda hotel is a seaside 450-bed ,
luxury hotel with extensive gardens of lawns, olive ,
trees, hibiscus, bougainvillea, oleander, jasmine, ,
roses, rosemary, etc. and has about 1000m. of ,
coastline, including a sandy beach and rocky ,
promontories. We have received the Blue Flag for ,
the past 8 years running. The sandy beach is ,
about 150m. wide and 20m. deep, and is enclosed ,
in a tiny cove that protects it from the waves. The ,
entrance to the cove is closed off by red buoys, ,
and so is a swimmers-only zone extending about ,
100m. from the coastline. The beach can be ,
accessed only through the hotel, using tiled ,
pavements and masonry staircases and ramps. ,
The water sports facilities are located on one of ,
the rocky promontories and are secluded from the ,
beach. All manner of water sports are available, ,
including water ski, scuba diving, sailing, wind ,
surfing, and canoes. There are also jet skis, that ,
are carefully regulated by the local port authorities ,
as follows:4. No jet skis are allowing in the ,
afternoon, during the “siesta hours” (2-5pm.)5.,
Jet skis are not permitted to plane ,
near the coastline by more than 200m. and are ,
required to maintain idle speed within this zone ,
only for entering and exiting.6. All jet skis ,
have to be equipped by a remote-controlled ,
automatic cut-off system, in case the user violates ,
any of the rules. The hotel is environmentally ,
aware and promotes environmentally friendly ,
practices, despite adverse market conditions. A ,
scheme for recycling office paper failed dismally ,
when we discovered that the recycling contractor ,
did nothing of the kind and actually dumped the ,
paper in a landfill, only to collect the subsidies. The ,
hotel invested € 160.000 in order to build a new ,
wastewater treatment plant of the highest ,
standards. Besides biological treatment ,
(continuous aeration and sludge recycling), we ,
also do multimedia filtration, chlorination, membrane ,
filtration and UV disinfection.Our wastewater ,
treatment plant is visited every year by local ,
schools and the children receive a comprehensive ,
lecture about its operation and the importance of ,
treating wastewater as far as the impact to ,
groundwater and the coast are concerned. In ,
addition, we schedule annual cleaning expeditions ,
with a team of hotel technicians to the local roads, ,
secluded beaches, the Elounda salt marsh, and the ,
chapel of St.Fokas. We inform our staff and guests ,
about our activities and make sure we participate ,
in all the important environmental holidays (Earth ,
Day, World Environment Day, Blue Flag Day, and ,
Clean Up the World Day)",Lasithi,Elounda,"Elounda, Beach located in Lasithi"
 ,Lasithi,Elounda1,"Elounda 1, Beach located in Lasithi"
"“Poros 2” is a sandy beach located in Elounda,
Beach (next to sister hotel, Elounda Bay Palace), a,
luxury resort on the northeastern coast of the,
island of Crete. The resort organizes, yearly,,
environmental training activities such as seminars,,
lectures, clean up drawing and photo competitions.,
The size of the beach is lengthwise approximately,
500m and widthwise approximately 200m and the,
nearby natural surroundings are filled with,
seasonal plants and flowers, as well as, natural,
trees and plants common in the area. Additionally,,
the beach facilities include water sports. For,
more information on how to reach “Poros 2”,,
please contact us by telephone or fax or visit our,
website www.eloundabeach.gr",Lasithi,Poros2,"Poros 2, Beach located in Lasithi"
,Lasithi,Chiona,"Chiona, Beach located in Lasithi"
,Lasithi,Karavostasi,"Karavostasi, Beach located in Lasithi"
,Lasithi,Chiona,"Chiona, Beach located in Lasithi"
"Our sandy beach DRIRES of DRIROS BEACH Hotel ,
is length 176 meters and width 10-25 meters. ,
There are a lot of trees (olive trees, palm trees etc) ,
and plants. In the surrounding area there is one ,
more hotel and several complexes of apartments ,
and water sports facilities during the summer. The ,
beach is easily accessible by using one stair and a ,
ramp.With several environmental education ,
activities such us lectures, beach clean up, ,
drawing and photo competition, printed material, ,
we are trying to sensitize our guests, our staff and ,
the habitants of out area  concerning the nature’s ,
protection.For further information you can visit our ,
website www.eloundabluebay.gr .",Lasithi,Driros,"Driros, Beach located in Lasithi"
"“Poros 1” is a sandy beach located in Elounda Bay ,
Palace (next to sister hotel, Elounda Beach), a ,
luxury resort on the northeastern coast of the ,
island of Crete.  The resort organizes, yearly, ,
environmental training activities such as seminars, ,
lectures, clean up drawing and photo competitions. ,
The size of the beach is lengthwise approximately ,
200m and widthwise approximately 100m and the ,
nearby natural surroundings are filled with ,
seasonal plants and flowers, as well as, natural ,
trees and plants common in the area. Additionally, ,
the beach facilities include water sports.   For ,
more information on how to reach “Poros 1”, ,
please contact us by telephone or fax or visit our ,
website www.eloundabay.gr",Lasithi,Poros1,"Poros 1, Beach located in Lasithi"
text,image,address,municipality,beach_name,region
"Punta beach is a beautiful beach with pebbles, a ,
resort for the whole area of Egialia. The beach is ,
situated in the Municipality of Diakopto and is easily ,
accessible through the Old National Road Korinthu-,
Patras, just about three Klm, from the centre of ,
Diakopto. The Beach has  800 meters length and ,
30 meters width. Heather, Efkalyptus and pine ,
trees are all over the beach and there rooms to ,
rent, as well as, café and restaurants. There are ,
no organized sport facilities but during summer time ,
there are lectures and environmental activities ,
organized by the Municipality of Diakopto ,
(brochures, and information on marine and coastal ,
environment). For more information you can link to : ,
www.diakopto.gr/tourismos.htm",,"Pounta, Beach located in Achaia",,Pounta,Achaia
text,image,address,municipality,beach_name,region
"- SANDY - PEBBLES,
RESORT - LIFEGUARD/LIFESAVING,
EQUIPMENT, FACILITIES FOR THE,
DISABLED PEOPLE, SPORT FACILITIES,,
RENT CAR/BIKES/BICYCLES, HOTELS,,
RENT ROOMS,
- SEMINAR, LECTURE, CLEAN UP,,
DRAWING COMPETITION,
- 5TH JUNE - 1ST JULY.",,"Platanidia, Beach located in Magnisia",,Platanidia,Magnisia
" , , ",,"Vathi, Beach located in Lakonia",,Vathi,Lakonia
"Name of the beach: Tserdakia,
Corporation: Municipality of Paros,
Address: Parikia, Paros,
Community: Kyklades,
P.C. : 84400,
Tel.: 2284021200,
Fax: 2284024752,
Type of beach: Beach with sand,
Placed in rural area,
Description of the environmental education,
facilities: Lectures, Clean up.,
Facilities: Sport facilities,
Description of the location of the beach: Hotels and,
Rent rooms,
Description of nearby natural areas:Length of the,
beach: 1,000 mWidth of the beach: 50 mType of,
trees: Sea treesOther: Sand hills,
Description of how to get to the beach:By bus, car,,
motorbike, bike, feet.,
Link to website for the beach/municipality:,
www.paros.gr,
,
Tserdakia beach is a sandy beach placed in rural,
area. It‘s popular for the sport facilities such as,
scuba diving and windsurfing. There are kiosks,
where it is possible to rent equipment for water,
sports and to obtain instruction for their use. Near,
the beach you can find hotels and rent rooms to,
stay. The beach has length 1,000 meters and,
width 50 meters approximately and there sea trees,
and sand hills. You can go to the beach by bus,,
car, motorbike, bicycle and/or by feet. More,
information you can find on the link: www.paros.gr.",,"Tserdakia, Beach located in Kyklades",,Tserdakia,Kyklades
