text,region,beach_name
"The beach of Magana located in rural area is,
covered with a lot of smooth sand. 2 kilometers of,
sandy beach with progressive deepening, suitable,
for those new to swimming. Ideal for families and,
water sports.The environmental education facilities,
carried out are Conference, Clean up Drawing,
competitions and Photo competitions.It's location is,
south of Xanthi and there are many Rent Rooms,
and hotels in the wide area of the Beach.How to,
get to the sea: By all means of transportation.,
Airport and Harbour from Kavala, and Train from,
Xanthi.Web site Link:,
www.topeiros.gr/en/turism/beaches.htm",,"Mangana, Beach located in Xanthi",,Mangana,Xanthi
,,"Vrasna, Beach located in Thessaloniki",,Vrasna,Thessaloniki
"The coast finds in built-up band, her type is ,
ammodis and has length 850m. roughly and width ,
20m. roughly. Ashore they exist armirikia a species ,
of trees that sprouts the coasts. In her wider ,
space exist hotels/rented rooms, ,
cafeterias/restaurants, become rentings of cars, ,
motor cycles and bicycles also they become also ,
marine spor. The access ashore is easy because ,
oll the cars are parking areas free of charge in ,
spaces of quartering rented from the Municipality ,
Naxos that is found near ashore. The ,
environmental activities concern in cleaning of ,
coasts, reports on the subject the environment and ,
seminars.",,"Ag. Georgios, Beach located in Kyklades",,AG.GEORGIOS,Kyklades
"The hotel CRETA STAR is found on the Scaleta,
coastline in the municipality of Arkadi on the island,
of Crete, Greece. The Scaleta beach of the,
CRETA STAR hotel has a length of 250m and width,
30m, it is sandy and contains pebbles. Our tourist,
resort is found on the Scaleta coastline with other,
hotels and rent room accommodations. The,
environmental educational activities carried out in,
our hotel include conferences, seminars, lectures,,
coast cleaning and drawing competitions. Facilities,
which are available on our coastline include sea,
sports, rent-a-car, rent-a-bike and rent bicycles.,
Around the coast are found the «Tamarisk» trees,
and oleander bushes. The flora in the nearby,
areas include the daffodil sea, the fauna seen,
include the gull and the shallow. Access to the,
coast is from the interior of the hotel. To provide,
easy access to the beach for all of our customers,
and particularly persons with special needs,
wooden walkways and ramps exist.",,"Skaleta, Beach located in Rethymno",,Skaleta,Rethymno
,,"Plaka Dilesiou, Beach located in Voiotia",,PlakaDilesiou,Voiotia
"The Saint Isidoros is a beach with pebbles, it has,
500 meters length, 10 meters width and is both an,
urban area and a summer resort. It is surrounded,
by mountains and has rich flora (olive trees,,
cypresses, mulberries) and fauna (labruses,,
octopuses, dolphins, prawns, lobsters, ink,
fishes). It is only 2 kilometers far from the village,
of Antikyra and 35 kilometers from the capital of,
our local area. Also, Antikyra has the advantage,
that it is not far away from Athens, the capital of,
Greece, it is only 160 Km from it. Visitors are easy,
to come in Antikyra by driving their cars or using,
the public transport. In Antikyra and beach of,
Saint Isidoros there are a lot of hotels and rent,
rooms, which offer all the modern facilities.,
Also, there are environmental education facilities,
like drawing exhibition, fishery seminars, and,
beach cleaning. Website of Antikyra :,
www.antikyra.gr",,"Ag. Isidoros, Beach located in Voiotia",,Ag.Isidoros,Voiotia
"The hotel STERIS is found opposite the Rethymno ,
coast in the municipality of Rethymno on the island ,
of Crete, Greece. The sandy Rethymno beach of ,
STERIS is 300m in length and a width of 50m. Our ,
tourist resort is found in the same location as other ,
hotels and rent rooms.The environmental ,
educational activities carried out in our hotel ,
include seminars, coast cleaning and drawing ,
competitions. Facilities which are available on our ,
coast include sea sports, rent a car, rent a bike ,
and rent bicycles. Around the coast are found ,
the «Tamaris» and Oleander bushes. The flora in ,
the nearby areas include the daffodil sea, the ,
fauna seen include the Gull and the Shallow. ,
Access to the Rethymno beach is from the public ,
street. To provide access to the beach for all of ,
our hotel patrons and particularly persons with ,
special needs wooden walkways and ramps exist.",,"Rethymno 3, Beach located in Rethymno",,Rethymno3,Rethymno
,,"Rethymno 4/Missiria, Beach located in Rethymno",,Rethymno4Missiria,Rethymno
"MEGA AMMOS is located in Municipality of Sivota, ,
Thesprotia, GreeceType of Beach   : Beach with ,
sandResort BeachEnvironmental education ,
facilities: Conferences, Lectures, Clean up, ,
Expeditions Sea sport facilitiesHotels, rent ,
roomsLength of the beach: 250 m. Width : ,
Lifeguard/life saving equipmentFacilities for ,
disabled peopleTransportation: Sivota is directly ,
linked to the port of Igoumenitsa, to the Airport of ,
Ioannina and Corfu",,"Mega Ammos, Beach located in Thresprotia",,MegaAmmos,Thresprotia
" , , , ",,"Glicorisa, Beach located in Samos",,GLICORISA,Samos
,,"Valtos, Beach located in Preveza",,Valtos,Preveza
,,"Tsoukes, Beach located in Preveza",,Tsoukes,Preveza
"Myrodato beach –which is the applicant beach for,
the blue flag - has a length of 1000 m and a width,
of 50 m. It lies to a rural area grown with acacias,,
poplars mulberries and planes as well as bulrush.,
It is a sandy beach, 100 m away from which one,
can find rooms to let. There is road access through,
the local road network. During the summer season,
there are frequent bus routes to the beach that,
fulfill all requirements.There are no sport facilities,
or cars and motorbikes for hire in the area.Every,
year certain activities and events related to,
environmental education are held by the,
municipality.The beach is presented in the website,
of Avdera municipality: www.avdera.gr",,"MYRODATO, Beach located in Xanthi",,MYRODATO,Xanthi
,,"Mandra, Beach located in Xanthi",,Mandra,Xanthi
"The beach which belongs to the Municipality of ,
Paralia stretches out in length 3, 5 km and has an ,
average width 40m. It is a sandy beach whose ,
main part (about 2 km) belongs to Paralia, a well – ,
known Tourist Resort. There are many hotels, ,
rooms to let and sport facilities. The remaining part ,
of the beach belongs in the rural areas of Kalithea ,
and Peristasi! In the area of Paralia annual, many ,
environmental and educational activities takes ,
place such a bicycle races, clean up programmes, ,
and seminars. Schools and their pupils participate ,
in these activities. The beach of Paralia is easily ,
reached via the National Road and Railway either ,
from Thessaloniki and Makedonia Airport or from ,
Athens.",,"Paralia, Beach located in Pieria",,Paralia,Pieria
"Olympiaki Akti is the only beach of Municipality of ,
Katerini and is siuated in an urban area. The ,
access to the beach is extremely easy and can be ,
succeeded in the provincial road Katerini – ,
Olympiaki akti. Signs can help tourists a lot.The ,
beach is sandy, with length 1600m and width ,
40m.Its flora is described below:Trees1. Populus ,
alba, 2. Phoenix canariensis, 3. Chamaerops ,
excelsa, 4. Albiria julibrisin, 5. Platanus orientalis, ,
Platanus acerifolia, 6. Acer negundo, 7. Elaegnus ,
angustifoliaBushes1. Gynerium angenteum, 2. ,
Cotoneaster horizontalis, 3. Tuhya ,
occidentalis ‘‘pyramidalis’’On the other hand, fauna ,
is not interesting, because there are not unique or ,
threatened and endangered species.Near the ,
beach, there are plenty of hotels and rooms for let. ,
Furthermore, there are places that tourists can rent ,
a car, bikes or bicycles.During the year, many ,
environmental educational facilities take place, ,
such as drawing competitions, conferences and ,
cleaning up, which contribute to the environmental ,
sensitization of citizens and tourists.Although, ,
Municipality of Katerini has a web site ,
(www.katerini.gr), Olympiaki Akti has not ,
mentioned anywhere.",,"Olympiaki, Beach located in Pieria",,Olympiaki,Pieria
"Mesi coast is located just 2 kilometres east of Fanari village. Following a breathtaking coastal route of 6 km between the sea and the Alyki lagoon, either by driving a car or by riding a bike, takes you to the beach of ‘’Mesi”. This beautiful beach is characterized by white sands and turquoise waters. Next to the beach and at a distance of about 150 meters is the namesake seasonal settlement. The landscape is topped by a wonderful copse of pines expanding in a 17 acres area.,Finally, Fanari village offers bright and tastefully furnished rooms most of them having a sea view. Within a short distance walk, guests can also find many restaurants.,You can contact us at ,.",,"Mesi, Beach located in Rodopi",,Mesi,Rodopi
"5 km west of the center of Igoumenitsa, you can ,
find a wide stretch of white sandy beaches with ,
crystal shallow blue waters. Ideal for families and ,
people that enjoy water sports- such as water ,
skiing, wind surfing, water rides etc. Close to ,
the beaches you will find small sea pond areas ,
where blue and white cranes breed and live. ,
Eucalyptus trees, which give some shade, line the ,
road parallel to the beach. You can also find ,
facilities for camping and caravan parking.Along ,
the 8 km stretch of beach there are few café bars, ,
which serve a variety of good food and drinks. ,
There are also tennis, volley and basketball courts ,
where people can play and during the year ,
tournaments are held.Every summer there are ,
exhibitions programs with photographic and ,
paintings of the area. Children’s water games from ,
the ages 6-12 years are also held together with ,
serious tree planting programs. You can visit these ,
beaches using cars or local buses, which leave ,
the town regularly (every half hour). There is also ,
a local path (paved) where people can walk or ride ,
bicycles to the beaches.",,"Drepano, Beach located in Thresprotia",,Drepano,Thresprotia
,,"Korinos, Beach located in Pieria",,Korinos,Pieria
,,"Fanari/Ioulia, Beach located in Rodopi",,FanariIoulia,Rodopi
"Type of Beach : Beach with sandRuralDescription,
of the environmental education facilities: Seminar,,
Lecture, Clean up, Other environmental facilities,
carried outFacilities:Sport facilities : NoRent a car :,
NoRent bikes : NoRent bicycles : NoDescription of,
the location of the beachHotels : YesRent rooms :,
YesDescription of nearby natural areas- Length of,
the Beach: 1 Km – Width: 20.50m- Type of Trees:,
Eucalyptus – pine tree – cypress tree- Type of,
bushes: -- Type of flora: Machia- Type of fauna:,
and adequate faunaDescription of how to get to,
the beach:By vertical roads with the Peripherical,
National RoadLink to website for the,
beach/municipality: -",,"Monolithi, Beach located in Preveza",,Monolithi,Preveza
"The beach is sandy, it is found in a resideritial,
area . There are water sports, hotels and rooms to,
let for the accommodation of the visitors in the,
wider area . The length of the beach is about,
1500meters and the width is 50 metres, there are,
accesses along the beach with stairs made of,
wood and cement as well as ramps for people,
with special needs the beaches of our municipality,
at the municipal area of Loutsa are approachable,
to visitors through the following traveling ways.1.,
By bus from the travel agencies of,
Preveza Igoumenitsa 40 Kilometres.2. By private,
cars following the coastline road through Preveza-,
Igoumenitsa and reverslyBy aeroplane through the,
airport of Aktio",,"Loutsa, Beach located in Preveza",,Loutsa,Preveza
,,"Kyani, Beach located in Serres",,Kyani,Serres
"
,
,
,
,
,
,
,
,    



, ",,"Rethymno 1, Beach located in Rethymno",,Rethymno1,Rethymno
,,"Kyani, Beach located in Preveza",,Kyani,Preveza
,,"Rodakino, Beach located in Rethymno",,RODAKINO,Rethymno
"The hotel PEARL BEACH is found in front of the ,
Rethymno coast in the municipality of Rethymno on ,
the island of Crete, Greece. The sandy Rethymno ,
beach of PEARL BEACH is 150m in length and a ,
width of 50m. Our tourist resort is found in the ,
same location as other hotels and rent rooms.The ,
environmental educational activities carried out in ,
our hotel include seminars, coast cleaning and ,
drawing competitions. Facilities which are available ,
on our coast include sea sports, rent a car, rent a ,
bike. Around the coast are found the «Cypress» ,
tree and Giant fennel. The flora in the nearby areas ,
include the Daffodil sea, the fauna seen include the ,
gull and the goldfinch. Access to the Rethymno ,
beach is from the public street. To provide access ,
to the Rethymno beach for all of our customers ,
and particularly persons with special needs ,
wooden walkways, steps and ramps exist.",,"Rethymno 2, Beach located in Rethymno",,Rethymno2,Rethymno
,,"Kallithea/Mediterranean Village, Beach located in Pieria",,KallitheaMediterraneanVillage,Pieria
"The GRECOTEL EL GRECO – a resort hotel - is ,
surrounded by fields of wheat, poppies, colourful ,
vegetables and the gardens of the hotel run down ,
to the beach (400 m long, width 5-10 m with sand ,
and pebbles). There are fantastic views from the ,
terrace-style main building and bungalows over the ,
crystal clear blue Mediterranean Sea. The ,
environmental education facilities are seminars, ,
lectures, clean-up actions, drawing competitions, ,
information for the protection of the sea-,
turtle “Caretta-caretta”and the protection of the ,
environment. The hotel provides tennis facilities, ,
rent a car, rent bikes/bicycles and watersport ,
facilities (school, windsurfing, catamaran sailing, ,
pedaloes, canoes). Due to the protection of the ,
sea-turtle “Caretta-caretta” waterskiing, ,
parasailing, wetbikes are available at Grecotel ,
Rithymna Beach, 2 km from the hotel, as well as a ,
Scuba-diving centre. In the surrounding area are ,
some other hotels, Rent Rooms, Ìini Markets, some ,
Tavernas and Bars. The flora and fauna in this part ,
of Crete is: Tamarisk, Olive, Carob, Pine Tree, ,
Cypress, Blue gum tree, Oleander Jerusalem sage, ,
Cistus, Rosemary, Oregano, Monk’s pepper, ,
Lentisc, Fleabane, Statice, Sea Daffodil, Yellow ,
horned poppy, Giant Fennel, Sea Spurge, ,
Asphodel, Squirting Cucumber etc.Fauna: Gull, ,
Kestrel, Kingfisher, Swallow, House Sparrow, ,
Goldfinch, Carrion Crow, Bats etc. How to get to ,
the beach: Staircases and ramps.Link to website ,
for the beach: www.grecotel.gr.",,"Pigianos Kampos, Beach located in Rethymno",,PigianosKampos,Rethymno
"TYPE OF BEACH: Mostly sandy beach with some,
pebbles. The beach is near a large resort and 500,
meters form the center of the traditional village of,
Pythagorion.TYPES OF ENVIRONMENTAL AND,
EDUCATIONAL ACTIVITIES: Doryssa Bay Hotel in,
cooperation with the Municipality of Pythagorio has,
organized seminars, lectures and a vast collection,
of nature photographs as well as community,
based activities.FACILITIES: On the beach you can,
find organized water-sports, bar, restaurant,,
playground, tennis court, beach volley, and mini,
football court and mini golf.LANDSCAPE: The,
beach in front of the hotel is approximately315,
meters and part of a larger beach that extends,
from the Castle of Lycourgos to the village of Ireon.,
The part of the beach in front of the hotel is,
covered with small trees and flowerbeds, and part,
covered with grass.ACCESS: The access to the,
beach is possible through the small village based,
on the traditional architectural line of Samos with,
small stone covered paths wooden ramps and,
bridges. The entire resort is adjacent to the main,
road of Hora-Pythagorion.CONTACTS: For further,
information you my access our site for Doryssa,
Bay Hotel: www.doryssa-bay.gr and for the,
Municipality of Pythagorio: www.pythagorion.net",,"Potokaki 1, Beach located in Samos",,Potokaki1,Samos
"''Panormo Lake Beach'', is considered to be a ,
sandy one at a picturesque resort area.Regarding ,
the environmental education facilities, Grecotel ,
Marine Palace Hotel, hosts conferences, seminars, ,
lectures, cleaning ups.When comes to the facilities ,
regarding the beach area, there are available sport ,
and rent a car/bike/bicycle facilities.Around the ,
beach area, there are hotels and rooms to rent.The ,
length of ''Panormo Lake beach'' is 300 meter, ,
whereas its width, 25 meter long.As to how to get ,
to the beach, just follow the New National Road ,
Rethymnon-Heraclion, reach the settlement of ,
Panormo and from there, as soon as you see the ,
Marine Palace Hotel, at once you find yourself at ,
the ''Panormo Lake Beach''.Our Website link is as ,
follows: www.grecotel.gr",,"Panormo Limni, Beach located in Rethymno",,PanormoLimni,Rethymno
,,"Kallithea, Beach located in Pieria",,Kallithea,Pieria
,,"Bali Varkotopos, Beach located in Rethymno",,BaliVarkotopos,Rethymno
"The hotel HAPIMAG is found on the Damnoni coast ,
in the municipality of Finika on the island of Crete, ,
Greece. HAPIMAG is a sandy beach with a length ,
of 300m and width of 30m. Our tourist resort is ,
found on the Damnoni coast with other hotels and ,
rent room accommodations.The environmental ,
educational activities performed in our hotel include ,
seminars, cleaning of the beach and drawing ,
competitions. The facilities which are available on ,
the coast include sea sports, rent-a-car, rent-a-,
bike and rent bicycles. Around the coast are found ,
the Phoenix theophrasti trees and the Pistacia ,
lentiscus bushes. The flora in the surrounding ,
areas are the Tamarix parviflora, the fauna include ,
the Phalacrocorax and Alcedo atthis. Access to ,
the beach is from the public street. Customer ,
access to the beach is from wooden walkways ,
and ramps. The internet address is ,
www.hapimag.com.",,"Damnoni, Beach located in Rethymno",,Damnoni,Rethymno
,,"Lianos Kavos Lavris, Beach located in Rethymno",,LianosKavosLavris,Rethymno
,,"Bali Livadi, Beach located in Rethymno",,BaliLivadi,Rethymno
"In order to get to the Arogi Beach, you have to ,
take the Thassaloniki - Komotini National road and ,
before you reach Komotini, take the Porto-Lagos ,
exit, from where you’ll find, after a 8- Kilometers ,
drive, the village of Fanari and then you will find ,
the Arogi Beach after a 2- Kilometers drive. The ,
beach is sandy and is part of a summer resort of ,
the Prefecture. Near the beach there are hotels ,
and rented accommodation. The length of the ,
beach is 2,5 Kilometers and its width varies ,
between 15 and 25 meters. Along the beach ,
among others there are Pine trees, Acacias and ,
Oleanders. The Flora of the area includes the ,
following species: Atriplex Halimus, Anthemis ,
Tomentosa, Erignium Maritimum, while the Fauna ,
includes: Petala, Chitton, Falco Elegnorae, Snakes, ,
Larus Auduinni, Littorina. Also a number of ,
environmental education activities such as drawing ,
competitions, clean ups, etc has taken place. You ,
can contact us at: egiros @ otenet.gr",,"Arogi, Beach located in Rodopi",,Arogi,Rodopi
" , ",,"Serraiki, Beach located in Thessaloniki",,Serraiki,Thessaloniki
"“Rihios” beach in Stavros Thessaloniki is a,
beautiful sandy beach. It is located in the rural area,
of Stavros in Strymonicos Bay and it is 1000,
meters long and 30 meters wide. Around the,
beach there are many plane trees and,
bushes.Schools and associations participate in the,
cleaning of the beach very often and also take,
pictures of the beaches. The pupils draw the,
beauties of the sea and articulate their ideas and,
suggestions both about the maintenance of the,
existing beauty and about its qualitative,
improvement.In the broadest area of the beach,
there are plenty of hotels and rooms for rent that,
can accommodate a great number of tourists,
during the summer season. There are also many,
facilities like car, motorbikes and bicycles rental as,
well as sports facilities.The access to the beach is,
easy, since Stavros is located on the 80th,
kilometer of the National Road from Thessaloniki to,
Kavala. Now that part of the Egnatia Road is ready,,
the access is even easier. The signs in the,
entrance of Stavros show the way to the beautiful,
beach “Rihios”.Visit our website: www.dimos-,
rentinas.gr",,"Stavros/Dytiki, Beach located in Thessaloniki",,StavrosDytiki,Thessaloniki
"Ôhe sandy coast of MINOS MARE is a coast with ,
length 85m and width 60m. It’s found in a tourist ,
resort and in the wider space of our coast exist ,
also other hotels.Activities as sea sports they do ,
not exist. Some of the educational activities in our ,
hotel are coast cleaning, painting or photograph ,
competition, video, slides, planting flowers ,
etc.Round of the coast they find «almyrikia» ,
(special of tree) while a lot of turtles caretta visit ,
us each year so that they give birth. The access to ,
the coast becomes either from the interior of hotel ,
or from the public street. For the better service of ,
all our customers and particularly for persons with ,
special needs exist wooden corridors and ramps. ,
Our web site is www.minos gr",,"Platanias B/Rethymno 6, Beach located in Rethymno",,PlataniasBRethymno6,Rethymno
 ,,"Potamos, Beach located in Thessaloniki",,Potamos,Thessaloniki
"“Milies” beach in Stavros Thessaloniki is a beautiful,
sandy beach. It is located in the rural area of,
Stavros in Strymonicos Bay and it is 1000 meters,
long and 20 meters wide. Around the beach there,
are many trees, mostly plane trees and,
acacias.Schools and associations participate in the,
cleaning of the beach very often and also take,
pictures of the beaches. The pupils draw the,
beauties of the sea and articulate their ideas and,
suggestions both about the maintenance of the,
existing beauty and about its qualitative,
improvement.In the broadest area of the beach,
there are plenty of hotels and rooms for rent that,
can accommodate a great number of tourists,
during the summer season. There are also many,
facilities like car, motorbikes and bicycles rental as,
well as sports facilities.The access to the beach is,
easy, since Stavros is located on the 80th,
kilometer of the National Road from Thessaloniki to,
Kavala. Now that part of the Egnatia Road is ready,,
the access is even easier. The beautiful,
beach “Milies” is located in the area “Milies” 1 km,
from Stavros city center.Visit our website:,
www.dimos-rentinas.gr",,"Stavros/Anatoliki, Beach located in Thessaloniki",,StavrosAnatoliki,Thessaloniki
,,"Porto Fino, Beach located in Thessaloniki",,PORTOFINO,Thessaloniki
,,"Peraia, Beach located in Thessaloniki",,Peraia,Thessaloniki
,,"Neoi Epivates, Beach located in Thessaloniki",,NeoiEpivates,Thessaloniki
,,"Agia Triada/Pikpa, Beach located in Thessaloniki",,AgiaTriadaPikpa,Thessaloniki
" , , ,
",,"Nea Vrasna, Beach located in Thessaloniki",,NeaVrasna,Thessaloniki
 ,,"Asprovalta, Beach located in Thessaloniki",,Asprovalta,Thessaloniki
,,"Ag. Galini / Ystero Varkotopi, Beach located in Rethymno",,Ag.Galini/YsteroVarkotopi,Rethymno
"Porto Molo beach –which is the applicant beach for,
the blue flag- has a length of 500 m and a width of,
30 m. It lies to a rural area grown with acacias. It is,
a sandy beach, 100 m away from which one can,
find rooms to let. There is road access through the,
local road network. During the summer season,
there are frequent bus routes to the beach that,
fulfill all requirements.There are no sport facilities,
or cars and motorbikes for hire in the area.Every,
year certain activities and events related to,
environmental education are held by the,
municipality.The beach is presented in the website,
of Avdera municipality: www.avdera.gr",,"AVDIRA/PORTO MOLO, Beach located in Xanthi",,AVDIRAPORTOMOLO,Xanthi
"The ALIANTHOS hotel is found on the Plakias coast in the municipality of Finika on the island of Crete, Greece. ALIANTHOS is a sandy beach with a length of 280m and width of 40m. Our tourist resort is found on the Plakias coast with other hotels and rent rooms.The environmental educational activities performed in our hotel include seminars, cleaning of the beach, drawing and photo competitions. The facilities which are available on the coast include sea sports, rent-a-car, rent-a-bike and rent bicycles. Around the coast are found the Tamarisk trees and the Cistus bushes. The flora in the surrounding areas are the Giant fennel, the fauna include the Larus argentatus and Carduelis carduelis. Access to the beach is from the public street. To provide access to the beach for all of our customers and persons with special needs wooden walkways and ramps exist.",,"Plakias, Beach located in Rethymno",,Plakias,Rethymno
"
,
,
,
,
,
,
,    



, ",,"Adelianos Kampos A, Beach located in Rethymno",,AdelianosKamposA,Rethymno
,,"Bouka, Beach located in Messinia",,Bouka,Messinia
"Anastasi beach is sandy and is part of a 4 km-long ,
beach. There are plants, palm trees and citrus ,
trees along the beach. It is situated in a populated ,
area and is easily accessible either by car (10 ,
minutes drive from the centre of Kalamata) or by ,
bus (service is sufficient and frequent during the ,
summer).In the wider area around the beach there ,
are hotels and rooms for rent covering the needs ,
of visitors. Visitors that choose to stay in these ,
hotels and rooms, and inhabitants of the area may ,
access the beach also on foot.Those preferring to ,
move more freely and also visit the wider area may ,
rent cars, motorbikes or bicycles in one of the ,
agencies in the area.Various environment-related ,
activities are organised to raise awareness on the ,
protection of the environment, such as campaigns ,
for cleaning the beach, painting and photo ,
contests, etc.",,"ANAT. KALAMATA 1/ANASTASI, Beach located in Messinia",,ANAT.KALAMATA1ANASTASI,Messinia
